<?xml version="1.0" encoding="utf-8" ?>
<Summary xmlns:xsi="http://www.w3.org/2001/XMLSchema-instance" xsi:noNamespaceSchemaLocation="summary.xsd">
    <!-- YYYY-MM-DD   -->
    <date>2023-07-18</date>
    <!-- non negative   -->
    <amount>1902</amount>
    <!-- non negative   -->
    <discount>180</discount>
    <!-- min 1 max 1   -->
    <Dishes>
        <!-- non negative   -->
        <total>12</total>
        <!-- min 0 max unbounded       -->
        <Dish>
            <name>Steak</name>
            <!-- non negative    -->
            <sold>6</sold>
        </Dish>
        <Dish>
            <name>Steamed Vegetables</name>
            <!-- non negative    -->
            <sold>8</sold>
        </Dish>
    </Dishes>
</Summary>